<?xml version="1.0" encoding="UTF-8" standalone="no"?>
<!DOCTYPE map SYSTEM "mapDTD.dtd">
<map>
  <information>
    <spawn cooldown="4" spawnperso="true">
      <vecteur x="555.0" y="990.0"/>
      			<gun name="Minigun" weight="43"
				pathSprite="data/weapons/Minigun_1.png" soundPickup="GunCock_02"
				cooldown="0.03" uses="350" animPath="" warmupDuration="0.25"
				soundWarmup="warmup_minigun_01" bangSound="Bang1"
				noAmmoSound="no_ammo_01" bulletType="0" bulletSpeed="3500"
				damage="1" cannonLength="100" recoil="0.2" thrust="275" size="64"
				proba="1">

				<vecteur use="handPosL" x="-25" y="6" />
				<vecteur use="handPosR" x="3" y="3" />
			</gun>
			<gun name="assault" weight="43"
				pathSprite="data/weapons/Assaut_1.png" soundPickup="GunCock_01"
				cooldown="0.09" uses="100" animPath="" warmupDuration="0"
				soundWarmup="" bangSound="bang_tommy_gun_01"
				noAmmoSound="no_ammo_01" bulletType="0" bulletSpeed="3500"
				damage="1" cannonLength="58" recoil="1.6" thrust="200" size="64"
				proba="1">

				<vecteur use="handPosL" x="-25" y="8" />
				<vecteur use="handPosR" x="3" y="4" />
			</gun>
			<gun name="ion" weight="50"
				pathSprite="data/weapons/RayGun1_tr.png" soundPickup="GunCock_03"
				cooldown="0.12" uses="100" animPath="" warmupDuration="0.8"
				soundWarmup="IonCharge3" bangSound="BangIonGun"
				noAmmoSound="no_ammo_01" bulletType="1" bulletSpeed="3000"
				damage="1" cannonLength="50" recoil="1" thrust="200" size="64"
				proba="1">

				<vecteur use="handPosL" x="-25" y="6" />
				<vecteur use="handPosR" x="3" y="3" />
			</gun>
			<shotgun name="shotgun" weight="100"
				pathSprite="data/weapons/shotgun1.png" soundPickup="GunCock_02"
				cooldown="1.2" uses="6" animPath="" warmupDuration="0"
				soundWarmup="" bangSound="bang_shotgun_01" noAmmoSound="no_ammo_01"
				multiShot="25" dispersion="0.3" bulletType="0" bulletSpeed="3200"
				damage="2" cannonLength="60" recoil="2" thrust="2500" size="2"
				proba="1">

				<vecteur use="handPosL" x="15" y="0" />
				<vecteur use="handPosR" x="5" y="0" />
			</shotgun>
			<entities>
				<mesh src="data/meshes/item_pickup/weapon_pickup.obj">
					<vecteur use="position" x="0" y="40" z="0" />
					<vecteur use="rotation" x="0" y="0" z="0" w="1" />
					<vecteur use="scale" x="35" y="35" z="35" />
				</mesh>
			</entities>
      
    </spawn>
    <spawn cooldown="4" spawnperso="true">
      <vecteur x="1665.0" y="1270.0"/>
    				<gun name="Minigun" weight="43"
				pathSprite="data/weapons/Minigun_1.png" soundPickup="GunCock_02"
				cooldown="0.03" uses="350" animPath="" warmupDuration="0.25"
				soundWarmup="warmup_minigun_01" bangSound="Bang1"
				noAmmoSound="no_ammo_01" bulletType="0" bulletSpeed="3500"
				damage="1" cannonLength="100" recoil="0.2" thrust="275" size="64"
				proba="1">

				<vecteur use="handPosL" x="-25" y="6" />
				<vecteur use="handPosR" x="3" y="3" />
			</gun>
			<gun name="assault" weight="43"
				pathSprite="data/weapons/Assaut_1.png" soundPickup="GunCock_01"
				cooldown="0.09" uses="100" animPath="" warmupDuration="0"
				soundWarmup="" bangSound="bang_tommy_gun_01"
				noAmmoSound="no_ammo_01" bulletType="0" bulletSpeed="3500"
				damage="1" cannonLength="58" recoil="1.6" thrust="200" size="64"
				proba="1">

				<vecteur use="handPosL" x="-25" y="8" />
				<vecteur use="handPosR" x="3" y="4" />
			</gun>
			<gun name="ion" weight="50"
				pathSprite="data/weapons/RayGun1_tr.png" soundPickup="GunCock_03"
				cooldown="0.12" uses="100" animPath="" warmupDuration="0.8"
				soundWarmup="IonCharge3" bangSound="BangIonGun"
				noAmmoSound="no_ammo_01" bulletType="1" bulletSpeed="3000"
				damage="1" cannonLength="50" recoil="1" thrust="200" size="64"
				proba="1">

				<vecteur use="handPosL" x="-25" y="6" />
				<vecteur use="handPosR" x="3" y="3" />
			</gun>
			<shotgun name="shotgun" weight="100"
				pathSprite="data/weapons/shotgun1.png" soundPickup="GunCock_02"
				cooldown="1.2" uses="6" animPath="" warmupDuration="0"
				soundWarmup="" bangSound="bang_shotgun_01" noAmmoSound="no_ammo_01"
				multiShot="25" dispersion="0.3" bulletType="0" bulletSpeed="3200"
				damage="2" cannonLength="60" recoil="2" thrust="2500" size="2"
				proba="1">

				<vecteur use="handPosL" x="15" y="0" />
				<vecteur use="handPosR" x="5" y="0" />
			</shotgun>
			<entities>
				<mesh src="data/meshes/item_pickup/weapon_pickup.obj">
					<vecteur use="position" x="0" y="40" z="0" />
					<vecteur use="rotation" x="0" y="0" z="0" w="1" />
					<vecteur use="scale" x="35" y="35" z="35" />
				</mesh>
			</entities>
    	
    </spawn>
    <spawn cooldown="4" spawnperso="true">
      <vecteur x="1515.0" y="1581.0"/>
    </spawn>
    <spawn cooldown="4" spawnperso="true">
      <vecteur x="1181.0" y="1621.0"/>
    </spawn>
    <spawn cooldown="4" spawnperso="true">
      <vecteur x="940.0" y="1509.0"/>
    </spawn>
    <spawn cooldown="4" spawnperso="true">
      <vecteur x="884.0" y="981.0"/>
    </spawn>
    <spawn cooldown="4" spawnperso="true">
      <vecteur x="1321.0" y="1221.0"/>
    </spawn>
    <spawn cooldown="4" spawnperso="true">
      <vecteur x="2040.0" y="1021.0"/>
    </spawn>
    <spawn cooldown="4" spawnperso="true">
      <vecteur x="1881.0" y="765.0"/>
    </spawn>
    <spawn cooldown="4" spawnperso="true">
      <vecteur x="537.0" y="518.0"/>
    </spawn>
    <spawn cooldown="4" spawnperso="true">
      <vecteur x="2206.0" y="656.0"/>
    </spawn>
    <gravity>
      <vecteur x="0.0" y="9.807"/>
    </gravity>
    <cameraBound w="1000" x="-5000" y="-1000" z="5000"/>
    <sky>
      <vecteur use="top" x="1.0" y="1.0" z="1.0"/>
      <vecteur use="bottom" x="1.0" y="1.0" z="1.0"/>
    </sky>
  </information>
  <entities>
    <plateform name="Platform_112914452335756">
      <vecteur use="position" x="1950.0" y="920.0"/>
      <vecteur use="extent" x="150.0" y="10.0"/>
    </plateform>
    <plateform name="Platform_112942391715285">
      <vecteur use="position" x="1970.0" y="1500.0"/>
      <vecteur use="extent" x="150.0" y="260.0"/>
    </plateform>
    <plateform name="Platform_112916870225275">
      <vecteur use="position" x="860.0" y="1150.0"/>
      <vecteur use="extent" x="150.0" y="10.0"/>
    </plateform>
    <plateform name="Platform_112951185004082">
      <vecteur use="position" x="1630.0" y="1400.0"/>
      <vecteur use="extent" x="150.0" y="10.0"/>
    </plateform>
    <plateform name="Platform_112962950967978">
      <vecteur use="position" x="1930.0" y="1400.0"/>
      <vecteur use="extent" x="150.0" y="10.0"/>
    </plateform>
    <plateform name="Platform_113117648977621">
      <vecteur use="position" x="280.0" y="890.0"/>
      <vecteur use="extent" x="150.0" y="260.0"/>
    </plateform>
    <plateform name="Platform_113132263142783">
      <vecteur use="position" x="570.0" y="640.0"/>
      <vecteur use="extent" x="150.0" y="10.0"/>
    </plateform>
    <plateform name="Platform_113093640526062">
      <vecteur use="position" x="2260.0" y="990.0"/>
      <vecteur use="extent" x="150.0" y="260.0"/>
    </plateform>
    <plateform name="Platform_112938386266838">
      <vecteur use="position" x="1470.0" y="1770.0"/>
      <vecteur use="extent" x="650.0" y="10.0"/>
    </plateform>
    <plateform name="Platform_112924758937226">
      <vecteur use="position" x="860.0" y="1900.0"/>
      <vecteur use="extent" x="150.0" y="260.0"/>
    </plateform>
    <plateform name="Platform_112939914629739">
      <vecteur use="position" x="1340.0" y="1400.0"/>
      <vecteur use="extent" x="150.0" y="10.0"/>
    </plateform>
    <plateform name="Platform_112918657612292">
      <vecteur use="position" x="570.0" y="1400.0"/>
      <vecteur use="extent" x="150.0" y="260.0"/>
    </plateform>
  </entities>
</map>
