<?xml version="1.0" encoding="UTF-8"?>
<!DOCTYPE map SYSTEM "mapDTD.dtd" >
<map>
	<information>
		<spawn spawnperso="true" cooldown="2">
			<vecteur x="-700" y="-1" />
			<gun name="Minigun" weight="43"
				pathSprite="data/weapons/Minigun_1.png" soundPickup="GunCock_02"
				cooldown="0.03" uses="350" animPath="" warmupDuration="0.25"
				soundWarmup="warmup_minigun_01"
				bangSound="Bang1"
				noAmmoSound="no_ammo_01" bulletType="0"
				bulletSpeed="35" damage="1" cannonLength="2" recoil="0.2"
				thrust="2.75" size="64" proba="1">

				<vecteur use="handPosL" x="-2.5" y=".6" />
				<vecteur use="handPosR" x=".3" y=".3" />
			</gun>
			<gun name="assault" weight="43"
				pathSprite="data/weapons/Assaut_1.png" soundPickup="GunCock_01"
				cooldown="0.09" uses="100" animPath="" warmupDuration="0"
				soundWarmup=""
				bangSound="bang_tommy_gun_01"
				noAmmoSound="no_ammo_01" bulletType="0"
				bulletSpeed="35" damage="1" cannonLength=".58" recoil="1.6"
				thrust="2.00" size="64" proba="1">

				<vecteur use="handPosL" x="-2.5" y=".8" />
				<vecteur use="handPosR" x=".3" y=".4" />
			</gun>
			<gun name="ion" weight="50"
				pathSprite="data/weapons/RayGun1_tr.png" soundPickup="GunCock_03"
				cooldown="0.12" uses="100" animPath="" warmupDuration="0.8"
				soundWarmup="IonCharge3"
				bangSound="BangIonGun"
				noAmmoSound="no_ammo_01" bulletType="1"
				bulletSpeed="30" damage="1" cannonLength=".5" recoil="1"
				thrust="2.00" size="64" proba="1">

				<vecteur use="handPosL" x="-2.5" y=".6" />
				<vecteur use="handPosR" x=".3" y=".1" />
			</gun>
			<shotgun name="shotgun" weight="100"
				pathSprite="data/weapons/shotgun1.png" soundPickup="GunCock_02"
				cooldown="1.2" uses="6" animPath="" warmupDuration="0"
				soundWarmup=""
				bangSound="bang_shotgun_01"
				noAmmoSound="no_ammo_01" multiShot="25" dispersion="0.3" bulletType="0"
				bulletSpeed="32" damage="2" cannonLength=".6" recoil="2"
				thrust="25.00" size="2"  proba="1">

				<vecteur use="handPosL" x="1.5" y="0" />
				<vecteur use="handPosR" x=".5" y="0" />
			</shotgun>
			<entities>
				<mesh src="data/meshes/item_pickup/weapon_pickup.obj">
					<vecteur use="position" x="0" y="1" z="0" />
					<vecteur use="rotation" x="0" y="0" z="0" w="1" />
					<vecteur use="scale" x=".35" y=".35" z=".35" />
				</mesh>
			</entities>
		</spawn>
		
		<spawn spawnperso="true" cooldown="2">
			<vecteur x="7.0" y="-1" />
			<gun name="Minigun" weight="43"
				pathSprite="data/weapons/Minigun_1.png" soundPickup="GunCock_02"
				cooldown="0.03" uses="350" animPath="" warmupDuration="0.25"
				soundWarmup="warmup_minigun_01"
				bangSound="Bang1"
				noAmmoSound="no_ammo_01" bulletType="0"
				bulletSpeed="35" damage="1" cannonLength="1" recoil="0.2"
				thrust="2.75" size="64" proba="1">

				<vecteur use="handPosL" x="-2.5" y=".6" />
				<vecteur use="handPosR" x=".3" y=".3" />
			</gun>
			<gun name="assault" weight="43"
				pathSprite="data/weapons/Assaut_1.png" soundPickup="GunCock_01"
				cooldown="0.09" uses="100" animPath="" warmupDuration="0"
				soundWarmup=""
				bangSound="bang_tommy_gun_01"
				noAmmoSound="no_ammo_01" bulletType="0"
				bulletSpeed="35" damage="1" cannonLength=".58" recoil="1.6"
				thrust="2.00" size="64" proba="1">

				<vecteur use="handPosL" x="-2.5" y=".8" />
				<vecteur use="handPosR" x=".3" y=".4" />
			</gun>
			<gun name="ion" weight="50"
				pathSprite="data/weapons/RayGun1_tr.png" soundPickup="GunCock_03"
				cooldown="0.12" uses="100" animPath="" warmupDuration="0.8"
				soundWarmup="IonCharge3"
				bangSound="BangIonGun"
				noAmmoSound="no_ammo_01" bulletType="1"
				bulletSpeed="30" damage="1" cannonLength=".5" recoil="1"
				thrust="2.00" size="64" proba="1">

				<vecteur use="handPosL" x="-2.5" y=".6" />
				<vecteur use="handPosR" x=".3" y=".3" />
			</gun>
			<shotgun name="shotgun" weight="100"
				pathSprite="data/weapons/shotgun1.png" soundPickup="GunCock_02"
				cooldown="1.2" uses="6" animPath="" warmupDuration="0"
				soundWarmup=""
				bangSound="bang_shotgun_01"
				noAmmoSound="no_ammo_01" multiShot="25" dispersion="0.3" bulletType="0"
				bulletSpeed="32" damage="3" cannonLength=".6" recoil="2"
				thrust="25.00" size="2"  proba="1">

				<vecteur use="handPosL" x="1.5" y="0" />
				<vecteur use="handPosR" x=".5" y="0" />
			</shotgun>
			<melee name="kata" weight="5"
				pathSprite="data/weapons/sword_01.png" soundPickup="sword_draw_01"
				cooldown="0.12" uses="350" animPath="" warmupDuration="0.1"
				soundWarmup="" damage="3"
				bangSound="woosh_01" size="2" proba="1">
				
				<vecteur use="handPosL" x="-50" y="0" />
				<vecteur use="handPosR" x="0" y="0" />
			</melee>
			<entities>
				<mesh src="data/meshes/item_pickup/weapon_pickup.obj">
					<vecteur use="position" x="0" y="1" z="0" />
					<vecteur use="rotation" x="0" y="0" z="0" w="1" />
					<vecteur use="scale" x=".35" y=".35" z=".35" />
				</mesh>
			</entities>
		</spawn>

		<gravity>
			<vecteur x="0" y="9.807" />
		</gravity>

		<cameraBound w="100" x="-500" y="-100" z="500" />

		<sky>
			<vecteur x="0.659" y="0.835" z="0.996" use="bottom" />
			<vecteur x="0.016" y="0.145" z="0.565" use="top" />
		</sky>
	</information>

	<entities>
		<plateform>
			<vecteur x="0" y="12" use="position" />
			<vecteur x="75" y="10" use="extent" />
		</plateform>
		
		<plateform>
			<vecteur x="125" y="-5" use="position" />
			<vecteur x="50" y="3" use="extent" />
		</plateform>
		
		<plateform>
			<vecteur x="-125" y="-5" use="position" />
			<vecteur x="50" y="3" use="extent" />
		</plateform>

		<mesh src="data/meshes/windmills/Windmill_01_Static.obj">
			<vecteur use="position" x="22500" y="28000" z="-62500" />
			<vecteur use="rotation" x="0" y=".2" z="0" w="1" />
			<vecteur use="scale" x="95" y="95" z="95" />
			<entities>
				<mesh src="data/meshes/windmills/Windmill_01_Blades.obj">
					<!-- <vecteur use="position" x="-300" y="1200" z="0" /> -->
					<vecteur use="position" x="21200" y="13500" z="-61500" />
					<vecteur use="rotation" x="0" y=".2" z="0" w="1" />
					<vecteur use="scale" x="95" y="95" z="95" />
				</mesh>
			</entities>
		</mesh>

		<mesh src="data/meshes/landscape_field/Hill.obj">
			<vecteur use="position" x="0" y="53500" z="-22000" />
			<vecteur use="rotation" x="-0.2" y="0" z="0" w="1" />
			<vecteur use="scale" x="30" y="30" z="30" />
		</mesh>

	</entities>
</map>
