<?xml version="1.0" encoding="UTF-8"?>
<!DOCTYPE map SYSTEM "mapDTD.dtd" >
<map>
	<information>
		<spawn cooldown="1">
			<vecteur x="0" y="0" />
		</spawn>

		<gravity>
			<vecteur x="0" y="9.807" />
		</gravity>

		<cameraPos x="0" y="0" z="8" />
		<cameraBound w="1000" x="-5000" y="-1000" z="5000" />

		<sky>
			<vecteur x="0.996" y="0.9098" z="0.003922" use="bottom" />
			<vecteur x="0.34901960784" y="0.13725490196" z="0.48235294118" use="top" />
		</sky>
	</information>

	<entities>
	</entities>
</map>
